<?xml version="1.0" encoding="UTF-8" ?>
<!DOCTYPE tests SYSTEM "./test.dtd">
<!--
-->
<tests>
    <test>
        <version no="1"/>
        <host>roke</host>
        <port>161</port>
        <socket_type type="STD"/>
        <community>public</community>
        <request type="getNext"> 
            <oid>
                <comment>system</comment>
                <variable>1.3.6.1.2.1.1</variable>
            </oid>
        </request>
        <request type="get"> 
            <oid>
                <comment>sysDescr</comment>
                <variable>1.3.6.1.2.1.1.1.0</variable>
            </oid>
        </request>
        <request type="set"> 
            <oid>
                <comment>sysLocation</comment>
                <variable>1.3.6.1.2.1.1.6.0</variable>
                <value>Westhawk Ltd</value>
            </oid>
        </request>
        <request type="mib"> 
            <oid>
                <comment>enterprises.42</comment>
                <variable>1.3.6.1.4.1.42</variable>
            </oid>
        </request>
    </test>
    <test>
        <version no="1"/>
        <host>ully</host>
        <port>161</port>
        <socket_type type="STD"/>
        <community>public</community>
        <request type="getNext"> 
            <oid>
                <comment>system</comment>
                <variable>1.3.6.1.2.1.1</variable>
            </oid>
        </request>
        <request type="get"> 
            <oid>
                <comment>sysDescr</comment>
                <variable>1.3.6.1.2.1.1.1.0</variable>
            </oid>
        </request>
        <request type="set"> 
            <oid>
                <comment>sysLocation</comment>
                <variable>1.3.6.1.2.1.1.6.0</variable>
                <value>Westhawk Ltd</value>
            </oid>
        </request>
    </test>
    <test>
        <version no="2c"/>
        <host>ully</host>
        <port>161</port>
        <socket_type type="STD"/>
        <community>public</community>
        <request type="getNext"> 
            <oid>
                <comment>system</comment>
                <variable>1.3.6.1.2.1.1</variable>
            </oid>
        </request>
        <request type="getBulk"> 
            <oid>
                <comment>sysUpTime</comment>
                <variable>1.3.6.1.2.1.1.3</variable>
            </oid>
            <oid>
                <comment>system</comment>
                <variable>1.3.6.1.2.1.1</variable>
            </oid>
            <non_rep>1</non_rep>
            <max_rep>5</max_rep>
        </request>
        <request type="get"> 
            <oid>
                <comment>sysDescr</comment>
                <variable>1.3.6.1.2.1.1.1.0</variable>
            </oid>
        </request>
        <request type="set"> 
            <oid>
                <comment>sysLocation</comment>
                <variable>1.3.6.1.2.1.1.6.0</variable>
                <value>Westhawk Ltd</value>
            </oid>
        </request>
        <request type="mib"> 
            <oid>
                <comment>host</comment>
                <variable>1.3.6.1.2.1.25</variable>
            </oid>
        </request>
    </test>
    <test>
        <version no="3"/>
        <host>212.30.73.70</host>
        <port>161</port>
        <socket_type type="STD"/>
        <usm>
            <username>noAuthUser</username>
            <context>
                <id>010000a1d41e4946</id>
                <name>public</name>
            </context>
            <auth ado="no"></auth>
        </usm>
        <request type="getNext"> 
            <oid>
                <comment>system</comment>
                <variable>1.3.6.1.2.1.1</variable>
            </oid>
        </request>
        <request type="getBulk"> 
            <oid>
                <comment>sysUpTime</comment>
                <variable>1.3.6.1.2.1.1.3</variable>
            </oid>
            <oid>
                <comment>system</comment>
                <variable>1.3.6.1.2.1.1</variable>
            </oid>
            <non_rep>1</non_rep>
            <max_rep>5</max_rep>
        </request>
        <request type="get"> 
            <oid>
                <comment>sysDescr</comment>
                <variable>1.3.6.1.2.1.1.1.0</variable>
            </oid>
        </request>
        <request type="set"> 
            <oid>
                <comment>sysLocation</comment>
                <variable>1.3.6.1.2.1.1.6.0</variable>
                <value>Westhawk Ltd</value>
            </oid>
        </request>
    </test>
    <test>
        <version no="3"/>
        <host>212.30.73.70</host>
        <port>161</port>
        <socket_type type="STD"/>
        <usm>
            <username>MD5_User</username>
            <context>
                <id>010000a1d41e4946</id>
                <name>public</name>
            </context>
            <auth ado="yes">
                <aproto>MD5</aproto>
                <apassw>AuthPassword</apassw>
            </auth>
            <priv pdo="no"></priv>
        </usm>
        <request type="getNext"> 
            <oid>
                <comment>system</comment>
                <variable>1.3.6.1.2.1.1</variable>
            </oid>
        </request>
        <request type="getBulk"> 
            <oid>
                <comment>sysUpTime</comment>
                <variable>1.3.6.1.2.1.1.3</variable>
            </oid>
            <oid>
                <comment>system</comment>
                <variable>1.3.6.1.2.1.1</variable>
            </oid>
            <non_rep>1</non_rep>
            <max_rep>5</max_rep>
        </request>
        <request type="get"> 
            <oid>
                <comment>sysDescr</comment>
                <variable>1.3.6.1.2.1.1.1.0</variable>
            </oid>
        </request>
        <request type="set"> 
            <oid>
                <comment>sysLocation</comment>
                <variable>1.3.6.1.2.1.1.6.0</variable>
                <value>Westhawk Ltd</value>
            </oid>
        </request>
    </test>
    <test>
        <version no="3"/>
        <host>212.30.73.70</host>
        <port>161</port>
        <socket_type type="STD"/>
        <usm>
            <username>MD5_DES_User</username>
            <context>
                <id>010000a1d41e4946</id>
                <name>public</name>
            </context>
            <auth ado="yes">
                <aproto>MD5</aproto>
                <apassw>AuthPassword</apassw>
            </auth>
            <priv pdo="yes">
                <ppassw>PrivPassword</ppassw>
            </priv>
        </usm>
        <request type="getNext"> 
            <oid>
                <comment>system</comment>
                <variable>1.3.6.1.2.1.1</variable>
            </oid>
        </request>
        <request type="getBulk"> 
            <oid>
                <comment>sysUpTime</comment>
                <variable>1.3.6.1.2.1.1.3</variable>
            </oid>
            <oid>
                <comment>system</comment>
                <variable>1.3.6.1.2.1.1</variable>
            </oid>
            <non_rep>1</non_rep>
            <max_rep>5</max_rep>
        </request>
        <request type="get"> 
            <oid>
                <comment>sysDescr</comment>
                <variable>1.3.6.1.2.1.1.1.0</variable>
            </oid>
        </request>
        <request type="set"> 
            <oid>
                <comment>sysLocation</comment>
                <variable>1.3.6.1.2.1.1.6.0</variable>
                <value>Westhawk Ltd</value>
            </oid>
        </request>
    </test>
    <test>
        <version no="3"/>
        <host>212.30.73.70</host>
        <port>161</port>
        <socket_type type="STD"/>
        <usm>
            <username>SHA_User</username>
            <context>
                <id>010000a1d41e4946</id>
                <name>public</name>
            </context>
            <auth ado="yes">
                <aproto>SHA1</aproto>
                <apassw>AuthPassword</apassw>
            </auth>
            <priv pdo="no"></priv>
        </usm>
        <request type="getNext"> 
            <oid>
                <comment>system</comment>
                <variable>1.3.6.1.2.1.1</variable>
            </oid>
        </request>
        <request type="getBulk"> 
            <oid>
                <comment>sysUpTime</comment>
                <variable>1.3.6.1.2.1.1.3</variable>
            </oid>
            <oid>
                <comment>system</comment>
                <variable>1.3.6.1.2.1.1</variable>
            </oid>
            <non_rep>1</non_rep>
            <max_rep>5</max_rep>
        </request>
        <request type="get"> 
            <oid>
                <comment>sysDescr</comment>
                <variable>1.3.6.1.2.1.1.1.0</variable>
            </oid>
        </request>
        <request type="set"> 
            <oid>
                <comment>sysLocation</comment>
                <variable>1.3.6.1.2.1.1.6.0</variable>
                <value>Westhawk Ltd</value>
            </oid>
        </request>
        <request type="mib"> 
            <oid>
                <comment>enterprises.412</comment>
                <variable>1.3.6.1.4.1.412</variable>
            </oid>
        </request>
    </test>
    <test>
        <version no="3"/>
        <host>212.30.73.70</host>
        <port>161</port>
        <socket_type type="STD"/>
        <usm>
            <username>SHA_DES_User</username>
            <context>
                <id>010000a1d41e4946</id>
                <name>public</name>
            </context>
            <auth ado="yes">
                <aproto>SHA1</aproto>
                <apassw>AuthPassword</apassw>
            </auth>
            <priv pdo="yes">
                <ppassw>PrivPassword</ppassw>
            </priv>
        </usm>
        <request type="getNext"> 
            <oid>
                <comment>system</comment>
                <variable>1.3.6.1.2.1.1</variable>
            </oid>
        </request>